<?xml version="1.0" encoding="utf-8"?>
  <?xml-stylesheet type="text/xsl" href="vbures.xsl"?>
  <!-- Odkaz na github: https://github.com/xburv005/Adresar --> 
<Adresar_konfigurace xmlns:xsi="http://www.w3.org/2001/XMLSchema-instance" xsi:noNamespaceSchemaLocation="vbures.xsd">

<!-- Obecné nastavení -->
<nastaveni-obecne>
	<charset>utf-8</charset>
	<jazyk>CZ</jazyk>
	<javascript>1</javascript>
	<vbscript>0</vbscript>
	<nastaveni-moduly>
		<komentare>1</komentare>
		<vyhledavani>1</vyhledavani>
	</nastaveni-moduly>
	<protokol>http</protokol>
	<omezeni-pristupu></omezeni-pristupu>	
	<kontakt-admin>admin@admin.cz</kontakt-admin>
</nastaveni-obecne>

<!-- Nastavení práv uživatelů -->
<tabulka-prav>
	<Pravo Jmeno="dělník"  Prikaz="CTENI">
		<prava>0</prava>
		<cteni>1</cteni>
		<zapis>0</zapis>
		<pridavani>0</pridavani>
		<mazani>0</mazani>
		<sprava-uziv>0</sprava-uziv>
		<uprava-sekci>0</uprava-sekci>
	</Pravo>
	<Pravo Jmeno="Mistr" Prikaz="CTENI A ZAPIS">
		<prava>1</prava>
		<cteni>1</cteni>
		<zapis>1</zapis>
		<pridavani>0</pridavani>
		<mazani>0</mazani>
		<sprava-uziv>0</sprava-uziv>
		<uprava-sekci>0</uprava-sekci>
	</Pravo>
	<Pravo Jmeno="správce" Prikaz="ZMENA UZIVATELE">
		<prava>2</prava>
		<cteni>1</cteni>
		<zapis>0</zapis>
		<pridavani>1</pridavani>
		<mazani>1</mazani>
		<sprava-uziv>1</sprava-uziv>
		<uprava-sekci>0</uprava-sekci>
	</Pravo>
	<Pravo Jmeno="Administrátor" Prikaz="ADMINISTRACE">
		<prava>3</prava>
		<cteni>1</cteni>
		<zapis>1</zapis>
		<pridavani>1</pridavani>
		<mazani>1</mazani>
		<sprava-uziv>1</sprava-uziv>
		<uprava-sekci>1</uprava-sekci>
	</Pravo>
</tabulka-prav>

<!-- Adresář PZ -->
  <Oddeleni Nazev="Přijaté zakázky"  Disk="I">
  	<pocet-zaznamu-na-soubor>25</pocet-zaznamu-na-soubor>
  	<Popis>Seznam přijatých zakázek.</Popis>
  		<Pristupova-prava>
  			<osoba id="0" Kod="0000">
  				<Jmeno>Návštěvník</Jmeno>
  				<Prijmeni></Prijmeni>
  				<Prihl-jmeno>guest</Prihl-jmeno>
  				<Pravomoce>0</Pravomoce>
  			</osoba>
  			<osoba id="1" Kod="0001">
  				<Jmeno>Martin</Jmeno>
  				<Prijmeni>Beneš</Prijmeni>
  				<Prihl-jmeno>admin</Prihl-jmeno>
  				<Pravomoce>3</Pravomoce>
  			</osoba>
  			<osoba id="2" Kod="0002">
  				<Jmeno>Petra</Jmeno>
  				<Prijmeni>Suchá</Prijmeni>
  				<Prihl-jmeno>suchap</Prihl-jmeno>
  				<Pravomoce>2</Pravomoce>
  			</osoba>
  			<osoba id="3" Kod="0003">
  				<Jmeno>Petr</Jmeno>
  				<Prijmeni>Šulc</Prijmeni>
  				<Prihl-jmeno>sulcp</Prihl-jmeno>
  				<Pravomoce>1</Pravomoce>
  			</osoba>
  			<osoba id="4" Kod="0004">
  				<Jmeno>Milan</Jmeno>
  				<Prijmeni>Macko</Prijmeni>
  				<Prihl-jmeno>mackm</Prihl-jmeno>
  				<Pravomoce>1</Pravomoce>
  			</osoba>
  		</Pristupova-prava>
  </Oddeleni>

  <!-- Adresář VZ -->
  <Oddeleni Nazev="Vyřešené zakázky"  Disk="I">
  	<pocet-zaznamu-na-soubor>25</pocet-zaznamu-na-soubor>
  	<Popis>Zakázky které již byli vyřešeny.</Popis>
  		<Pristupova-prava>
  			<osoba id="0" Kod="0000">
  				<Jmeno>Návštěvník</Jmeno>
  				<Prijmeni></Prijmeni>
  				<Prihl-jmeno>guest</Prihl-jmeno>
  				<Pravomoce>0</Pravomoce>
  			</osoba>
  			<osoba id="1" Kod="0001">
  				<Jmeno>Martin</Jmeno>
  				<Prijmeni>Beneš</Prijmeni>
  				<Prihl-jmeno>admin</Prihl-jmeno>
  				<Pravomoce>3</Pravomoce>
  			</osoba>
  			<osoba id="2" Kod="0005">
  				<Jmeno>Jitka</Jmeno>
  				<Prijmeni>Levá</Prijmeni>
  				<Prihl-jmeno>levaj</Prihl-jmeno>
  				<Pravomoce>2</Pravomoce>
  			</osoba>
  			<osoba id="3" Kod="0006">
  				<Jmeno>Miroslav</Jmeno>
  				<Prijmeni>Páka</Prijmeni>
  				<Prihl-jmeno>mirop</Prihl-jmeno>
  				<Pravomoce>1</Pravomoce>
  			</osoba>
  			<osoba id="4" Kod="0007">
  				<Jmeno>Pavlína</Jmeno>
  				<Prijmeni>Světlá</Prijmeni>
  				<Prihl-jmeno>svetp</Prihl-jmeno>
  				<Pravomoce>1</Pravomoce>
  			</osoba>
  		</Pristupova-prava>
  </Oddeleni>

  <!-- Adresář RE -->
  <Oddeleni Nazev="Reklamace"  Disk="I">
  	<pocet-zaznamu-na-soubor>25</pocet-zaznamu-na-soubor>
  	<Popis>Zakázky které byli reklamované</Popis>
  		<Pristupova-prava>
  			<osoba id="0" Kod="0000">
  				<Jmeno>Návštěvník</Jmeno>
  				<Prijmeni></Prijmeni>
  				<Prihl-jmeno>guest</Prihl-jmeno>
  				<Pravomoce>0</Pravomoce>
  			</osoba>
  			<osoba id="1" Kod="0001">
  				<Jmeno>Martin</Jmeno>
  				<Prijmeni>Beneš</Prijmeni>
  				<Prihl-jmeno>admin</Prihl-jmeno>
  				<Pravomoce>3</Pravomoce>
        </osoba>
  			<osoba id="2" Kod="0008">
  				<Jmeno>Libuše</Jmeno>
  				<Prijmeni>Jirásková</Prijmeni>
  				<Prihl-jmeno>jiral</Prihl-jmeno>
  				<Pravomoce>2</Pravomoce>
  			</osoba>
  			<osoba id="3" Kod="0009">
  				<Jmeno>Petr</Jmeno>
  				<Prijmeni>Lichý</Prijmeni>
  				<Prihl-jmeno>lichp</Prihl-jmeno>
  				<Pravomoce>1</Pravomoce>
  			</osoba>
  			<osoba id="4" Kod="0010">
  				<Jmeno>Tomáš</Jmeno>
  				<Prijmeni>Vídeňský</Prijmeni>
  				<Prihl-jmeno>vidt</Prihl-jmeno>
  				<Pravomoce>1</Pravomoce>
  			</osoba>
  		</Pristupova-prava>
  </Oddeleni>

  <!-- Adresář NZ -->
  <Oddeleni Nazev="Neplatné zakázky" Disk="I">
  	<pocet-zaznamu-na-soubor>15</pocet-zaznamu-na-soubor>
  	<Popis>Špatně zadané zakázky</Popis>
  		<Pristupova-prava>
  			<osoba id="0" Kod="0000">
  				<Jmeno>Návštěvník</Jmeno>
  				<Prijmeni></Prijmeni>
  				<Prihl-jmeno>guest</Prihl-jmeno>
  				<Pravomoce>0</Pravomoce>
  			</osoba>
  				<osoba id="1" Kod="0001">
  				<Jmeno>Martin</Jmeno>
  				<Prijmeni>Beneš</Prijmeni>
  				<Prihl-jmeno>admin</Prihl-jmeno>
  				<Pravomoce>3</Pravomoce>
  			</osoba>
  		<osoba id="2" Kod="0011">
  				<Jmeno>Jitka</Jmeno>
  				<Prijmeni>Levá</Prijmeni>
  				<Prihl-jmeno>levaj</Prihl-jmeno>
  				<Pravomoce>2</Pravomoce>
  			</osoba>
  			<osoba id="3" Kod="0012">
  				<Jmeno>David</Jmeno>
  				<Prijmeni>Gregor</Prijmeni>
  				<Prihl-jmeno>gregd</Prihl-jmeno>
  				<Pravomoce>1</Pravomoce>
  			</osoba>
  			<osoba id="4" Kod="0013">
  				<Jmeno>David</Jmeno>
  				<Prijmeni>Sula</Prijmeni>
  				<Prihl-jmeno>sulad</Prihl-jmeno>
  				<Pravomoce>1</Pravomoce>
  			</osoba>
  		</Pristupova-prava>
  </Oddeleni>

  <!-- Adresář ZA -->
  <Oddeleni Nazev="Zákazníci"  Disk="K">
  	<pocet-zaznamu-na-soubor>25</pocet-zaznamu-na-soubor>
  	<Popis>Seznam zákazníků</Popis>
  		<Pristupova-prava>
  			<osoba id="0" Kod="0000">
  				<Jmeno>Návštěvník</Jmeno>
  				<Prijmeni></Prijmeni>
  				<Prihl-jmeno>guest</Prihl-jmeno>
  				<Pravomoce>0</Pravomoce>
  			</osoba>
  		<osoba id="1" Kod="0001">
  				<Jmeno>Martin</Jmeno>
  				<Prijmeni>Beneš</Prijmeni>
  				<Prihl-jmeno>admin</Prihl-jmeno>
  				<Pravomoce>3</Pravomoce>
  			</osoba>
  			<osoba id="2" Kod="0014">
  				<Jmeno>Anna</Jmeno>
  				<Prijmeni>Drapáková</Prijmeni>
  				<Prihl-jmeno>drapa</Prihl-jmeno>
  				<Pravomoce>2</Pravomoce>
  			</osoba>
  			<osoba id="3" Kod="0015">
  				<Jmeno>Jiří</Jmeno>
  				<Prijmeni>Lachman</Prijmeni>
  				<Prihl-jmeno>lachj</Prihl-jmeno>
  				<Pravomoce>2</Pravomoce>
  			</osoba>
  			<osoba id="4" Kod="0016">
  				<Jmeno>Vojtěch</Jmeno>
  				<Prijmeni>Babiš</Prijmeni>
  				<Prihl-jmeno>babiv</Prihl-jmeno>
  				<Pravomoce>1</Pravomoce>
  			</osoba>
  			  		</Pristupova-prava>
  </Oddeleni>
</Adresar_konfigurace>